{
  "pr": null,
  "branch": "feat/dashboard-certification-factory-20260619",
  "worktree": "PR-specific clean worktree supplied by operator",
  "base_sha": "8cd17a51b1b80b7cc8c91e30f41af3df51f71e16",
  "head_sha": "37aa258c5f00b086ff9e18271e67fc0b8b890f5a",
  "goal": "Add non-promotional dashboard certification factory manifest and verifier.",
  "allowed_files": [
    "docs/dashboard-completion/dashboard-batch-manifest.json",
    "scripts/dashboard_certification_factory.py",
    ".crown/lanes/pr1117-dashboard-certification-factory.json"
  ],
  "forbidden_files": [
    "audit-artifacts/dashboard-completion/state/dashboard-certification-state.json",
    "docs/CURRENT_RELEASE_STATUS.md",
    "backend/crown_api/sample_payloads.py",
    "backend/crown_api/tests/test_dashboard_snapshot_summary_api.py"
  ],
  "validation_commands": [
    "python scripts/dashboard_certification_factory.py --manifest docs/dashboard-completion/dashboard-batch-manifest.json --state audit-artifacts/dashboard-completion/state/dashboard-certification-state.json --output audit-artifacts/dashboard-completion/factory/dashboard-certification-factory-report.json"
  ],
  "evidence_output_path": "audit-artifacts/dashboard-completion/factory/dashboard-certification-factory-report.json",
  "completion_claim_allowed": false,
  "independent_review_required": true,
  "notes": "This lane creates certification machinery only. It does not certify dashboards or promote the matrix."
}
